smartctl 6.5 2016-04-27 r4312 [x86_64-w64-mingw32-win10] (daily-20160427)
Copyright (C) 2002-16, Bruce Allen, Christian Franke, www.smartmontools.org

=== START OF INFORMATION SECTION ===
Model Number:                       Samsung SSD 950 PRO 256GB
Serial Number:                      CYBERDYNE_T1000
Firmware Version:                   1B0QBXX7
PCI Vendor/Subsystem ID:            0x144d
IEEE OUI Identifier:                0x002538
Controller ID:                      1
Number of Namespaces:               1
Namespace 1 Size/Capacity:          256,060,514,304 [256 GB]
Namespace 1 Utilization:            117,410,267,136 [117 GB]
Namespace 1 Formatted LBA Size:     512
Local Time is:                      Thu Apr 28 19:32:07 2016 CEST
Firmware Updates (0x06):            3 Slots
Optional Admin Commands (0x0007):   Security Format Frmw_DL
Optional NVM Commands (0x001f):     Comp Wr_Unc DS_Mngmt Wr_Zero Sav/Sel_Feat
Maximum Data Transfer Size:         32 Pages

Supported Power States
St Op     Max   Active     Idle   RL RT WL WT  Ent_Lat  Ex_Lat
 0 +     6.50W       -        -    0  0  0  0        5       5
 1 +     5.80W       -        -    1  1  1  1       30      30
 2 +     3.60W       -        -    2  2  2  2      100     100
 3 -   0.0700W       -        -    3  3  3  3      500    5000
 4 -   0.0050W       -        -    4  4  4  4     2000   22000

Supported LBA Sizes (NSID 0x1)
Id Fmt  Data  Metadt  Rel_Perf
 0 +     512       0         0

=== START OF SMART DATA SECTION ===
SMART overall-health self-assessment test result: PASSED

SMART/Health Information (NVMe Log 0x02, NSID 0xffffffff)
Critical Warning:                   0x00
Temperature:                        40 Celsius
Available Spare:                    100%
Available Spare Threshold:          10%
Percentage Used:                    0%
Data Units Read:                    1,769,281 [905 GB]
Data Units Written:                 1,384,224 [708 GB]
Host Read Commands:                 24,646,213
Host Write Commands:                19,105,374
Controller Busy Time:               38
Power Cycles:                       32
Power On Hours:                     129
Unsafe Shutdowns:                   6
Media and Data Integrity Errors:    0
Error Information Log Entries:      44

Error Information (NVMe Log 0x01, max 64 entries)
Num   ErrCount  SQId   CmdId  Status  PELoc          LBA  NSID    VS
  0         44     0  0x002a  0x4016  0x000            0   255     -
  1         43     0  0x0029  0x4016  0x000            0   255     -
  2         42     0  0x0049  0x4016  0x000            0   255     -
  3         41     0  0x0048  0x4016  0x000            0   255     -
  4         40     0  0x001f  0x4004  0x000            0     0     -
  5         39     0  0x001e  0x4004  0x000            0     0     -
  6         38     0  0x001f  0x4004  0x000            0     0     -
  7         37     0  0x001e  0x4004  0x000            0     0     -
  8         36     0  0x001f  0x4004  0x000            0     0     -
  9         35     0  0x001e  0x4004  0x000            0     0     -
 10         34     0  0x001d  0x4004  0x000            0     0     -
 11         33     0  0x001c  0x4004  0x000            0     0     -
 12         32     0  0x001d  0x4004  0x000            0     0     -
 13         31     0  0x001c  0x4004  0x000            0     0     -
 14         30     0  0x001d  0x4004  0x000            0     0     -
 15         29     0  0x001c  0x4004  0x000            0     0     -
